{
  "id": "START-ST-ENT-OBSERVABILITY-20260718113551192-688e5c",
  "kind": "profile_task_start_receipt",
  "schema_version": "profile-task-start-receipt:v1",
  "story_id": "ST-ENT-OBSERVABILITY",
  "phase": "implementation",
  "route": "claim_and_implement",
  "contract_id": "contract-ST-ENT-OBSERVABILITY-implementation",
  "contract_approval_hash": "598a42fa811695f74f568ebda2f09d0fb05415fab8db78a3d6c919b29d889c1e",
  "delivery_profile_ref": {
    "id": "AUT-PR-ENT-OBSERVABILITY",
    "path": ".sdlc/autonomy/deliveries/AUT-PR-ENT-OBSERVABILITY.json",
    "hash": "8ded0a39b0089cb963d9f12c1ea7ea6e591cdecaa70e3dcf41dad7fff9375236"
  },
  "autonomy_decision_ref": {
    "id": "AUT-DEC-20260718113550868-51e397",
    "path": ".sdlc/autonomy/decisions/AUT-DEC-20260718113550868-51e397.json",
    "hash": "1387b301b299770c5b994767bdfb224ffa5d47a3a852a34e94d249f3aa89b240"
  },
  "delivery_start_receipt_ref": {
    "id": "AUT-START-AUT-PR-ENT-OBSERVABILITY",
    "path": ".sdlc/autonomy/executions/AUT-PR-ENT-OBSERVABILITY/start.json",
    "hash": "2f3cabb62137e1a37db3c452fa0d43bc18affb15abe2d134e89b51d0579c37ff"
  },
  "autonomy_level": "checkpointed",
  "start_basis": "checkpointed-profile",
  "status": "confirmed",
  "authorization_ref": null,
  "authorization_use_ref": null,
  "authority_assurance": {
    "mode": "audit_only",
    "receipt_ref": null,
    "source": "declared_cli_attribution",
    "verified": false
  },
  "confirmed_by": {
    "id": "codex",
    "type": "agent",
    "name": "Codex",
    "email": null,
    "source": "default"
  },
  "confirmed_at": "2026-07-18T11:35:51.192Z",
  "audit": {
    "git": {
      "is_git_repo": true,
      "branch": "codex/ST-ENT-OBSERVABILITY",
      "head_sha": "35868d26c667dcbc22e61277bc25c26869595191",
      "is_dirty": true,
      "user": {
        "name": "Antonio Antenore",
        "email": "ant_ant95@hotmail.it"
      },
      "remotes": [
        "origin"
      ]
    },
    "run": {
      "run_id": null,
      "thread_id": "019f6f22-ba84-7631-bdaf-b074e51dba5d",
      "session_id": null,
      "tool": "agentic-sdlc-cli",
      "version": "0.11.0"
    }
  }
}
