{
  "id": "START-ST-PORTABLE-WORKFLOW-HARDENING-20260728090237832-bf789e",
  "kind": "profile_task_start_receipt",
  "schema_version": "profile-task-start-receipt:v1",
  "story_id": "ST-PORTABLE-WORKFLOW-HARDENING",
  "phase": "implementation",
  "route": "claim_and_implement",
  "contract_id": "contract-ST-PORTABLE-WORKFLOW-HARDENING-implementation-v2",
  "contract_approval_hash": "2b59bc7b1ecc9a14295e1c480ab84cb86fbc2bb8c20626735c80197e6645e94d",
  "delivery_profile_ref": {
    "id": "AUT-PR-PORTABLE-WORKFLOW-HARDENING-002",
    "path": ".sdlc/autonomy/deliveries/AUT-PR-PORTABLE-WORKFLOW-HARDENING-002.json",
    "hash": "795239acb7438514b6ded2e8f864b69bb3f294d9b4aae5ed54ebc6204be125ef"
  },
  "autonomy_decision_ref": {
    "id": "AUT-DEC-20260728090237398-67fff7",
    "path": ".sdlc/autonomy/decisions/AUT-DEC-20260728090237398-67fff7.json",
    "hash": "7f5a5c60960096144659ee839a254337dd2e64bd720a6a5afdd8e162a80c43b4"
  },
  "delivery_start_receipt_ref": {
    "id": "AUT-START-AUT-PR-PORTABLE-WORKFLOW-HARDENING-002",
    "path": ".sdlc/autonomy/executions/AUT-PR-PORTABLE-WORKFLOW-HARDENING-002/start.json",
    "hash": "85c8b717df538291820ef6bf9f0de172e7dcacf96e972e64e8f408f926ee4574"
  },
  "autonomy_level": "checkpointed",
  "start_basis": "checkpointed-profile",
  "status": "confirmed",
  "authorization_ref": null,
  "authorization_use_ref": null,
  "authority_assurance": {
    "mode": "audit_only",
    "receipt_ref": null,
    "source": "declared_cli_attribution",
    "verified": false
  },
  "confirmed_by": {
    "id": "codex",
    "type": "agent",
    "name": "Codex",
    "email": null,
    "source": "default"
  },
  "confirmed_at": "2026-07-28T09:02:37.833Z",
  "audit": {
    "git": {
      "is_git_repo": true,
      "branch": "codex/ST-PORTABLE-WORKFLOW-HARDENING",
      "head_sha": "87ddf9d2d1261804f0b92960ae91311ed97d90cd",
      "is_dirty": true,
      "user": {
        "name": "Antonio Antenore",
        "email": "ant_ant95@hotmail.it"
      },
      "remotes": [
        "origin"
      ]
    },
    "run": {
      "run_id": null,
      "thread_id": "019f6f22-ba84-7631-bdaf-b074e51dba5d",
      "session_id": null,
      "tool": "agentic-sdlc-cli",
      "version": "0.12.0"
    }
  }
}
