{
  "id": "START-ST-ENT-GOVERNANCE-20260718203802994-c2bdd5",
  "kind": "profile_task_start_receipt",
  "schema_version": "profile-task-start-receipt:v1",
  "story_id": "ST-ENT-GOVERNANCE",
  "phase": "implementation",
  "route": "claim_and_implement",
  "contract_id": "contract-ST-ENT-GOVERNANCE-implementation",
  "contract_approval_hash": "c6a89b6fe33cbdc0684d88f1f6ea318cbab7f333cb8c779d415e6de799f1063c",
  "delivery_profile_ref": {
    "id": "AUT-PR-ENT-GOVERNANCE",
    "path": ".sdlc/autonomy/deliveries/AUT-PR-ENT-GOVERNANCE.json",
    "hash": "41dfdef31bbfd52d601e26d158ed1f1db65b05646bab72118bd9e3b1a88dc231"
  },
  "autonomy_decision_ref": {
    "id": "AUT-DEC-20260718203802701-e564be",
    "path": ".sdlc/autonomy/decisions/AUT-DEC-20260718203802701-e564be.json",
    "hash": "32175791819c2eb7fdf53584475ddef73fee6c31eeb3840b2debd7e8c5d2af2e"
  },
  "delivery_start_receipt_ref": {
    "id": "AUT-START-AUT-PR-ENT-GOVERNANCE",
    "path": ".sdlc/autonomy/executions/AUT-PR-ENT-GOVERNANCE/start.json",
    "hash": "a60524e0a72fecd612e98dcb879a572a48617b1a5b0e6cc0a2e924ba90bec9da"
  },
  "autonomy_level": "checkpointed",
  "start_basis": "checkpointed-profile",
  "status": "confirmed",
  "authorization_ref": null,
  "authorization_use_ref": null,
  "authority_assurance": {
    "mode": "audit_only",
    "receipt_ref": null,
    "source": "declared_cli_attribution",
    "verified": false
  },
  "confirmed_by": {
    "id": "codex",
    "type": "agent",
    "name": "Codex",
    "email": null,
    "source": "default"
  },
  "confirmed_at": "2026-07-18T20:38:02.994Z",
  "audit": {
    "git": {
      "is_git_repo": true,
      "branch": "codex/ST-ENT-GOVERNANCE",
      "head_sha": "77880a5a45e794eecb31d92270847235ecac4cd5",
      "is_dirty": true,
      "user": {
        "name": "Antonio Antenore",
        "email": "ant_ant95@hotmail.it"
      },
      "remotes": [
        "origin"
      ]
    },
    "run": {
      "run_id": null,
      "thread_id": "019f6f22-ba84-7631-bdaf-b074e51dba5d",
      "session_id": null,
      "tool": "agentic-sdlc-cli",
      "version": "0.11.0"
    }
  }
}
