{
  "id": "START-ST-ENT-PORTFOLIO-R2-20260719005320955-6f1532",
  "kind": "profile_task_start_receipt",
  "schema_version": "profile-task-start-receipt:v1",
  "story_id": "ST-ENT-PORTFOLIO-R2",
  "phase": "implementation",
  "route": "claim_and_implement",
  "contract_id": "contract-ST-ENT-PORTFOLIO-R2-implementation-v2",
  "contract_approval_hash": "528e8e0629fe2f89a28c2279945f27e1fa7c08b49e4db0397ad7ec6c73cd937f",
  "delivery_profile_ref": {
    "id": "AUT-PR-ENT-PORTFOLIO-R2",
    "path": ".sdlc/autonomy/deliveries/AUT-PR-ENT-PORTFOLIO-R2.json",
    "hash": "9bb4f27f08915b10443d8fc230e4281b00288053ea1ab36d1d14e37ae172e66b"
  },
  "autonomy_decision_ref": {
    "id": "AUT-DEC-20260719005320468-5aa008",
    "path": ".sdlc/autonomy/decisions/AUT-DEC-20260719005320468-5aa008.json",
    "hash": "7042fcfecc8c09f51554f9897bcc1b228966d2864b485aff254306a0a259448c"
  },
  "delivery_start_receipt_ref": {
    "id": "AUT-START-AUT-PR-ENT-PORTFOLIO-R2",
    "path": ".sdlc/autonomy/executions/AUT-PR-ENT-PORTFOLIO-R2/start.json",
    "hash": "fdbf26a60a57bd01d82ea61afc1a86760c334a887f1046431ba0824eaa7e2372"
  },
  "autonomy_level": "checkpointed",
  "start_basis": "checkpointed-profile",
  "status": "confirmed",
  "authorization_ref": null,
  "authorization_use_ref": null,
  "authority_assurance": {
    "mode": "audit_only",
    "receipt_ref": null,
    "source": "declared_cli_attribution",
    "verified": false
  },
  "confirmed_by": {
    "id": "codex",
    "type": "agent",
    "name": "Codex",
    "email": null,
    "source": "default"
  },
  "confirmed_at": "2026-07-19T00:53:20.956Z",
  "audit": {
    "git": {
      "is_git_repo": true,
      "branch": "codex/ST-ENT-PORTFOLIO",
      "head_sha": "a135641fa474e623ac07ccd428d4bd9eff438dc2",
      "is_dirty": true,
      "user": {
        "name": "Antonio Antenore",
        "email": "ant_ant95@hotmail.it"
      },
      "remotes": [
        "origin"
      ]
    },
    "run": {
      "run_id": null,
      "thread_id": "019f6f22-ba84-7631-bdaf-b074e51dba5d",
      "session_id": null,
      "tool": "agentic-sdlc-cli",
      "version": "0.11.0"
    }
  }
}
